{
  "$schema": "https://json-schema.org/draft/2020-12/schema",
  "$id": "https://b7n0de.com/proofbundle/schemas/decision-receipt-v0.1.schema.json",
  "title": "proofbundle decision-receipt predicate v0.1",
  "description": "External/docs schema for the vendored decision-receipt/v0.1 predicate. The enforced validator is src/proofbundle/decision.py (hand-rolled, fail-closed). lowerCamelCase (ITE-9).",
  "type": "object",
  "additionalProperties": false,
  "required": [
    "schemaVersion", "decisionId", "decisionType", "decidedAt", "decisionMaker", "agent", "principal",
    "proposedAction", "inputSnapshot", "policyBoundary", "evidenceRefs", "decision"
  ],
  "$defs": {
    "sha256Digest": {
      "type": "object",
      "required": ["sha256"],
      "additionalProperties": false,
      "properties": {"sha256": {"type": "string", "pattern": "^[0-9a-f]{64}$"}}
    },
    "rfc3339z": {"type": "string", "pattern": "^\\d{4}-\\d{2}-\\d{2}T\\d{2}:\\d{2}:\\d{2}(\\.\\d+)?Z$"},
    "relationDigest": {
      "type": "object",
      "required": ["digestAlgorithm", "digest"],
      "additionalProperties": false,
      "description": "relation/v0.1 content-root reference. digestAlgorithm is EXPLICIT and REQUIRED — never defaulted (a missing value is exactly where algorithm confusion hides).",
      "properties": {
        "digestAlgorithm": {"const": "jcs-sha256-v1"},
        "digest": {"type": "string", "pattern": "^[0-9a-f]{64}$"}
      }
    },
    "typedDigest": {
      "type": "object",
      "required": ["type", "digestAlgorithm", "digest"],
      "additionalProperties": false,
      "description": "Typed digest reference (5.1, additive, OPTIONAL): an ADDITIONAL shape beside the existing `digest`/`artifactDigest`, carrying what the referenced thing IS (`type`) and what role the digest plays (`purpose`) alongside the algorithm and the value. Neither replaces nor deprecates anything: an entry may carry `digest` alone, `typedDigest` alone, or both. Shape follows the SCITT payload-binding draft's typed digest reference (see docs/SCITT_CPB_MAPPING.md, G3). NAMING: the draft writes `digest_alg`; this schema writes `digestAlgorithm` because that field already exists in `relationDigest` above with the same meaning and this document is lowerCamelCase throughout (ITE-9). Two names for one quantity in one file would be the drift, so the correspondence is recorded in the mapping document instead. `type` and `purpose` are the draft's names unchanged.",
      "properties": {
        "type": {"type": "string", "minLength": 1, "description": "what the referenced object IS, e.g. an eval receipt statement"},
        "purpose": {"type": "string", "minLength": 1, "description": "what role this digest plays for the referring receipt"},
        "digestAlgorithm": {"const": "jcs-sha256-v1", "description": "EXPLICIT and REQUIRED — never defaulted; a missing value is exactly where algorithm confusion hides"},
        "digest": {"type": "string", "pattern": "^[0-9a-f]{64}$"}
      }
    },
    "relationships": {
      "type": "array",
      "minItems": 1,
      "maxItems": 64,
      "description": "relation/v0.1 (EXPERIMENTAL, 3.3.0): typed, SIGNED lineage edges to earlier receipts — inside the predicate, so the receipt's own signature covers them (unlike detached anchors). A verified edge proves the issuer DECLARED the relation over exact bytes: relationship declared by issuer, not a statement of correctness. The old receipt stays valid for its bytes forever.",
      "items": {
        "type": "object",
        "additionalProperties": false,
        "required": ["relation", "targetReceiptDigest"],
        "properties": {
          "relation": {"enum": ["supersedes", "revises", "corrects", "retracts", "renews", "derivedFrom", "amends"]},
          "targetReceiptDigest": {"$ref": "#/$defs/relationDigest"},
          "targetSubjectDigest": {"$ref": "#/$defs/relationDigest"},
          "reason": {"type": "string"},
          "reasonCode": {"enum": ["correction", "rerun", "data-update", "methodology-update", "policy-change", "withdrawal", "other"]},
          "declaredAt": {"$ref": "#/$defs/rfc3339z"}
        }
      }
    }
  },
  "properties": {
    "schemaVersion": {"type": "string", "pattern": "^0\\.1\\.\\d+$"},
    "decisionId": {"type": "string", "minLength": 1},
    "decisionType": {"enum": ["preActionAuthorization", "postHocReview", "humanEscalation", "policySimulation"]},
    "decidedAt": {"$ref": "#/$defs/rfc3339z"},
    "recordedAt": {"$ref": "#/$defs/rfc3339z"},
    "decisionMaker": {
      "type": "object",
      "required": ["id"],
      "additionalProperties": false,
      "properties": {
        "id": {"type": "string"},
        "version": {"description": "a versioned extensions container — deliberately unconstrained here (see subject_binding.nested_closure_violations)"}
      }
    },
    "agent": {
      "type": "object",
      "required": ["id"],
      "additionalProperties": false,
      "properties": {
        "id": {"type": "string"},
        "version": {"type": "string"},
        "configurationDigest": {"$ref": "#/$defs/sha256Digest"}
      }
    },
    "principal": {
      "type": "object",
      "required": ["id"],
      "additionalProperties": false,
      "properties": {
        "id": {"type": "string"},
        "authnContextRef": {
          "type": "object",
          "additionalProperties": false,
          "properties": {"uri": {"type": "string"}, "digest": {"$ref": "#/$defs/sha256Digest"}}
        }
      }
    },
    "delegationRefs": {"type": "array"},
    "proposedAction": {
      "type": "object",
      "required": ["actionType"],
      "additionalProperties": false,
      "properties": {
        "actionType": {"type": "string"},
        "target": {
          "type": "object",
          "additionalProperties": false,
          "properties": {
            "name": {"type": "string"},
            "uri": {"type": "string"},
            "digest": {"$ref": "#/$defs/sha256Digest"}
          }
        },
        "method": {"type": "string"},
        "parametersDigest": {"$ref": "#/$defs/sha256Digest"},
        "parametersRef": {
          "type": "object",
          "minProperties": 1,
          "description": "a non-empty object reference to the parameters — a bare {} is fail-closed rejected (Finding 04)"
        },
        "parametersSchemaRef": {
          "type": "object",
          "additionalProperties": false,
          "properties": {"uri": {"type": "string"}, "digest": {"$ref": "#/$defs/sha256Digest"}}
        }
      },
      "anyOf": [{"required": ["parametersDigest"]}, {"required": ["parametersRef"]}]
    },
    "inputSnapshot": {
      "type": "array",
      "items": {
        "type": "object",
        "required": ["digest"],
        "additionalProperties": false,
        "properties": {
          "name": {"type": "string"},
          "uri": {"type": "string"},
          "digest": {"$ref": "#/$defs/sha256Digest"},
          "mediaType": {"type": "string"}
        }
      }
    },
    "policyBoundary": {
      "type": "object",
      "required": ["policyEngine", "policyId", "decisionPath"],
      "additionalProperties": false,
      "properties": {
        "policyEngine": {"type": "string", "minLength": 1},
        "policyId": {"type": "string", "minLength": 1},
        "decisionPath": {"type": "string", "minLength": 1},
        "policyDigest": {"$ref": "#/$defs/sha256Digest"},
        "bundleRevision": {"type": "string"},
        "validFrom": {"$ref": "#/$defs/rfc3339z"},
        "validUntil": {"$ref": "#/$defs/rfc3339z"}
      }
    },
    "evidenceRefs": {
      "type": "array",
      "items": {
        "type": "object",
        "required": ["relation", "digest"],
        "additionalProperties": false,
        "properties": {
          "relation": {"type": "string"},
          "digest": {"$ref": "#/$defs/sha256Digest", "description": "content root: sha256 over the RFC-8785 canonical Statement bytes of the referenced evidence (not an envelope/file hash)"},
          "artifactDigest": {"$ref": "#/$defs/sha256Digest", "description": "optional: sha256 of a concrete stored blob/envelope for exact retrieval pinning"},
          "uri": {"type": "string"},
          "predicateType": {"type": "string"},
          "typedDigest": {"$ref": "#/$defs/typedDigest", "description": "optional additive typed reference; when present it must be self-consistent, and it never replaces the required `digest`"}
        }
      }
    },
    "decision": {
      "type": "object",
      "required": ["verdict", "reasonCodes"],
      "additionalProperties": false,
      "properties": {
        "verdict": {"enum": ["ALLOW", "DENY", "REFUSE", "ESCALATE", "DEFER", "OBSERVE"]},
        "reasonCodes": {"type": "array", "minItems": 1, "items": {"type": "string"}},
        "humanReadableSummary": {"type": "string"},
        "obligations": {"type": "array"},
        "allowedScope": {"type": "array"}
      }
    },
    "notChecked": {
      "type": "array",
      "items": {
        "anyOf": [
          {
            "type": "object",
            "additionalProperties": false,
            "properties": {
              "field": {"type": "string"},
              "reason": {"type": "string"},
              "impact": {"type": "string"}
            }
          },
          {
            "type": "string",
            "deprecated": true,
            "description": "Legacy form, still accepted: a bare string naming what was not checked. Prefer the object form {field, reason, impact}. The enforced validator did not read the type of a notChecked entry before 2026-09-26 and accepted strings, and receipts in use carry them."
          }
        ]
      }
    },
    "decisionChangeConditions": {
      "type": "array",
      "items": {
        "type": "object",
        "additionalProperties": false,
        "properties": {
          "conditionType": {"type": "string"},
          "description": {"type": "string"},
          "requiredEvidenceType": {"type": "string"}
        }
      }
    },
    "actionOutcome": {
      "type": "object",
      "additionalProperties": false,
      "properties": {
        "status": {"enum": ["notAttempted", "blocked", "refused", "attempted", "executed", "failed", "unknown"]},
        "performedAt": {"anyOf": [{"$ref": "#/$defs/rfc3339z"}, {"type": "null"}]},
        "outcomeRef": {
          "anyOf": [
            {"type": "null"},
            {
              "type": "object",
              "additionalProperties": false,
              "properties": {"uri": {"type": "string"}, "digest": {"$ref": "#/$defs/sha256Digest"}}
            }
          ]
        }
      }
    },
    "traceContext": {"type": "object"},
    "privacy": {
      "type": "object",
      "additionalProperties": false,
      "properties": {
        "rawInputsIncluded": {"type": "boolean"},
        "redactionProfile": {"type": "string"},
        "erased": {"type": "array"},
        "masked": {"type": "array"}
      }
    },
    "validity": {
      "type": "object",
      "additionalProperties": false,
      "properties": {
        "audience": {"type": "array"},
        "nonce": {"type": "string"},
        "expiresAt": {"$ref": "#/$defs/rfc3339z"}
      }
    },
    "relationships": {"$ref": "#/$defs/relationships"}
  }
}
